{"campaign_seed":42,"corpus_root_sha256":"sha256:7fb3a04261779dc211f277f26ec7626636a954b24f23326cd318fb681faa511b","environment":{"java":"openjdk version \"17.0.18\" 2026-01-20\r\nOpenJDK Runtime Environment Temurin-17.0.18+8 (build 17.0.18+8)\r\nOpenJDK 64-Bit Server VM Temurin-17.0.18+8 (build 17.0.18+8, mixed mode, sharing)","operating_system":"Windows-11-10.0.26200-SP0","python":"3.13.14 (main, Jun 23 2026, 15:19:27) [MSC v.1944 64 bit (AMD64)]"},"generator_version":"1","interaction_buckets_covered":["add-line+address-variant","add-line+buyer-endpoint","add-line+buyer-name","add-line+buyer-reference","add-line+invoice-note-unicode","add-line+line-description","add-line+line-identifier","add-line+line-note","add-line+line-order","add-line+payment-due-date","add-line+payment-terms","add-line+price-scale","add-line+quantity-scale","add-line+remove-optionals","add-line+seller-endpoint","add-line+seller-identifier","add-line+seller-name","add-line+vat-rate","address-variant+add-line","address-variant+buyer-endpoint","address-variant+buyer-name","address-variant+buyer-reference","address-variant+invoice-note-unicode","address-variant+line-description","address-variant+line-identifier","address-variant+line-note","address-variant+line-order","address-variant+payment-due-date","address-variant+payment-terms","address-variant+price-scale","address-variant+quantity-scale","address-variant+remove-optionals","address-variant+seller-endpoint","address-variant+seller-identifier","address-variant+seller-name","address-variant+vat-rate","buyer-endpoint+add-line","buyer-endpoint+address-variant","buyer-endpoint+buyer-name","buyer-endpoint+buyer-reference","buyer-endpoint+invoice-note-unicode","buyer-endpoint+line-description","buyer-endpoint+line-identifier","buyer-endpoint+line-note","buyer-endpoint+line-order","buyer-endpoint+payment-due-date","buyer-endpoint+payment-terms","buyer-endpoint+price-scale","buyer-endpoint+quantity-scale","buyer-endpoint+remove-optionals","buyer-endpoint+seller-endpoint","buyer-endpoint+seller-identifier","buyer-endpoint+seller-name","buyer-endpoint+vat-rate","buyer-name+add-line","buyer-name+address-variant","buyer-name+buyer-endpoint","buyer-name+buyer-reference","buyer-name+invoice-note-unicode","buyer-name+line-description","buyer-name+line-identifier","buyer-name+line-note","buyer-name+line-order","buyer-name+payment-due-date","buyer-name+payment-terms","buyer-name+price-scale","buyer-name+quantity-scale","buyer-name+remove-optionals","buyer-name+seller-endpoint","buyer-name+seller-identifier","buyer-name+seller-name","buyer-name+vat-rate","buyer-reference+add-line","buyer-reference+address-variant","buyer-reference+buyer-endpoint","buyer-reference+buyer-name","buyer-reference+invoice-note-unicode","buyer-reference+line-description","buyer-reference+line-identifier","buyer-reference+line-note","buyer-reference+line-order","buyer-reference+payment-due-date","buyer-reference+payment-terms","buyer-reference+price-scale","buyer-reference+quantity-scale","buyer-reference+remove-optionals","buyer-reference+seller-endpoint","buyer-reference+seller-identifier","buyer-reference+seller-name","buyer-reference+vat-rate","invoice-id+add-line","invoice-id+address-variant","invoice-id+buyer-endpoint","invoice-id+buyer-name","invoice-id+buyer-reference","invoice-id+invoice-note-unicode","invoice-id+line-description","invoice-id+line-identifier","invoice-id+line-note","invoice-id+line-order","invoice-id+payment-due-date","invoice-id+payment-terms","invoice-id+price-scale","invoice-id+quantity-scale","invoice-id+remove-optionals","invoice-id+seller-endpoint","invoice-id+seller-identifier","invoice-id+seller-name","invoice-id+vat-rate","invoice-note-unicode+add-line","invoice-note-unicode+address-variant","invoice-note-unicode+buyer-endpoint","invoice-note-unicode+buyer-name","invoice-note-unicode+buyer-reference","invoice-note-unicode+line-description","invoice-note-unicode+line-identifier","invoice-note-unicode+line-note","invoice-note-unicode+line-order","invoice-note-unicode+payment-due-date","invoice-note-unicode+payment-terms","invoice-note-unicode+price-scale","invoice-note-unicode+quantity-scale","invoice-note-unicode+remove-optionals","invoice-note-unicode+seller-endpoint","invoice-note-unicode+seller-identifier","invoice-note-unicode+seller-name","invoice-note-unicode+vat-rate","line-description+add-line","line-description+address-variant","line-description+buyer-endpoint","line-description+buyer-name","line-description+buyer-reference","line-description+invoice-note-unicode","line-description+line-identifier","line-description+line-note","line-description+line-order","line-description+payment-due-date","line-description+payment-terms","line-description+price-scale","line-description+quantity-scale","line-description+remove-optionals","line-description+seller-endpoint","line-description+seller-identifier","line-description+seller-name","line-description+vat-rate","line-identifier+add-line","line-identifier+address-variant","line-identifier+buyer-endpoint","line-identifier+buyer-name","line-identifier+buyer-reference","line-identifier+invoice-note-unicode","line-identifier+line-description","line-identifier+line-note","line-identifier+line-order","line-identifier+payment-due-date","line-identifier+payment-terms","line-identifier+price-scale","line-identifier+quantity-scale","line-identifier+remove-optionals","line-identifier+seller-endpoint","line-identifier+seller-identifier","line-identifier+seller-name","line-identifier+vat-rate","line-note+add-line","line-note+address-variant","line-note+buyer-endpoint","line-note+buyer-name","line-note+buyer-reference","line-note+invoice-note-unicode","line-note+line-description","line-note+line-identifier","line-note+line-order","line-note+payment-due-date","line-note+payment-terms","line-note+price-scale","line-note+quantity-scale","line-note+remove-optionals","line-note+seller-endpoint","line-note+seller-identifier","line-note+seller-name","line-note+vat-rate","line-order+add-line","line-order+address-variant","line-order+buyer-endpoint","line-order+buyer-name","line-order+buyer-reference","line-order+invoice-note-unicode","line-order+line-description","line-order+line-identifier","line-order+line-note","line-order+payment-due-date","line-order+payment-terms","line-order+price-scale","line-order+quantity-scale","line-order+remove-optionals","line-order+seller-endpoint","line-order+seller-identifier","line-order+seller-name","line-order+vat-rate","payment-due-date+add-line","payment-due-date+address-variant","payment-due-date+buyer-endpoint","payment-due-date+buyer-name","payment-due-date+buyer-reference","payment-due-date+invoice-note-unicode","payment-due-date+line-description","payment-due-date+line-identifier","payment-due-date+line-note","payment-due-date+line-order","payment-due-date+payment-terms","payment-due-date+price-scale","payment-due-date+quantity-scale","payment-due-date+remove-optionals","payment-due-date+seller-endpoint","payment-due-date+seller-identifier","payment-due-date+seller-name","payment-due-date+vat-rate","payment-terms+add-line","payment-terms+address-variant","payment-terms+buyer-endpoint","payment-terms+buyer-name","payment-terms+buyer-reference","payment-terms+invoice-note-unicode","payment-terms+line-description","payment-terms+line-identifier","payment-terms+line-note","payment-terms+line-order","payment-terms+payment-due-date","payment-terms+price-scale","payment-terms+quantity-scale","payment-terms+remove-optionals","payment-terms+seller-endpoint","payment-terms+seller-identifier","payment-terms+seller-name","payment-terms+vat-rate","price-scale+add-line","price-scale+address-variant","price-scale+buyer-endpoint","price-scale+buyer-name","price-scale+buyer-reference","price-scale+invoice-note-unicode","price-scale+line-description","price-scale+line-identifier","price-scale+line-note","price-scale+line-order","price-scale+payment-due-date","price-scale+payment-terms","price-scale+quantity-scale","price-scale+remove-optionals","price-scale+seller-endpoint","price-scale+seller-identifier","price-scale+seller-name","price-scale+vat-rate","quantity-scale+add-line","quantity-scale+address-variant","quantity-scale+buyer-endpoint","quantity-scale+buyer-name","quantity-scale+buyer-reference","quantity-scale+invoice-note-unicode","quantity-scale+line-description","quantity-scale+line-identifier","quantity-scale+line-note","quantity-scale+line-order","quantity-scale+payment-due-date","quantity-scale+payment-terms","quantity-scale+price-scale","quantity-scale+remove-optionals","quantity-scale+seller-endpoint","quantity-scale+seller-identifier","quantity-scale+seller-name","quantity-scale+vat-rate","remove-optionals+add-line","remove-optionals+address-variant","remove-optionals+buyer-endpoint","remove-optionals+buyer-name","remove-optionals+buyer-reference","remove-optionals+invoice-note-unicode","remove-optionals+line-description","remove-optionals+line-identifier","remove-optionals+line-note","remove-optionals+line-order","remove-optionals+payment-due-date","remove-optionals+payment-terms","remove-optionals+price-scale","remove-optionals+quantity-scale","remove-optionals+seller-endpoint","remove-optionals+seller-identifier","remove-optionals+seller-name","remove-optionals+vat-rate","seller-endpoint+add-line","seller-endpoint+address-variant","seller-endpoint+buyer-endpoint","seller-endpoint+buyer-name","seller-endpoint+buyer-reference","seller-endpoint+invoice-note-unicode","seller-endpoint+line-description","seller-endpoint+line-identifier","seller-endpoint+line-note","seller-endpoint+line-order","seller-endpoint+payment-due-date","seller-endpoint+payment-terms","seller-endpoint+price-scale","seller-endpoint+quantity-scale","seller-endpoint+remove-optionals","seller-endpoint+seller-identifier","seller-endpoint+seller-name","seller-endpoint+vat-rate","seller-identifier+add-line","seller-identifier+address-variant","seller-identifie